{
  "language": "ko",
  "seo": {
    "title": "오나리 | Instagram · TikTok · YouTube",
    "description": "가난한 오타쿠૮₍´˘`ʃƪ₎ა \n#치이카와  #인형뽑기  #말랑이",
    "image": "media/onari-og.jpg",
    "imageAlt": "오나리 Instagram에 사용하는 캐릭터 이미지"
  },
  "theme": {
    "preset": "paper",
    "colors": {
      "background": "#F7FAFC",
      "surface": "#FFFFFF",
      "text": "#33424D",
      "muted": "#61717C",
      "accent": "#527A93",
      "accentSoft": "#EAF2F7",
      "border": "#DCE6EC",
      "badgeBackground": "#F6EAF0",
      "badgeText": "#875C72",
      "shadow": "#8197A6"
    },
    "platforms": {
      "tiktok": {
        "background": "#F6EAF0",
        "foreground": "#875C72"
      },
      "youtube": {
        "background": "#EAF2F7",
        "foreground": "#527A93"
      }
    },
    "typography": {
      "name": 24,
      "title": 16,
      "body": 16,
      "small": 12
    },
    "spacing": {
      "cardGap": 14,
      "sectionGap": 36,
      "cardPadding": 20
    },
    "featuredRatio": 1.7777777777777777,
    "cardRadius": 24,
    "contentWidth": 540,
    "font": "system"
  },
  "destinations": {
    "instagram": {
      "platform": "instagram",
      "label": "Instagram",
      "url": "https://www.instagram.com/onari.0"
    },
    "tiktok": {
      "platform": "tiktok",
      "label": "TikTok",
      "url": "https://www.tiktok.com/@orina1004"
    },
    "youtube": {
      "platform": "youtube",
      "label": "YouTube",
      "url": "https://www.youtube.com/@%EA%B0%80%EB%82%9C%EC%9D%84%EC%97%85%EC%9D%80%EB%8D%95%ED%9B%84"
    }
  },
  "resources": {
    "favicon": "favicon.svg",
    "ogGeneration": {
      "source": "media/onari-instagram.jpg",
      "width": 1200,
      "height": 630,
      "fit": "cover",
      "position": "center"
    },
    "backgroundImage": "media/onari-backgroung.jpeg"
  },
  "copy": {
    "skipLinks": "링크 목록으로 건너뛰기",
    "shareButton": "페이지 공유하기",
    "sharePanelTitle": "이 작은 공간을 나눠요",
    "shareCopy": "주소 복사",
    "shareNative": "다른 앱으로 공유",
    "shareCopied": "주소를 복사했어요!",
    "shareDone": "공유했어요. 고마워요!",
    "shareManual": "아래 주소를 선택해 복사해 주세요.",
    "shareUrlLabel": "페이지 주소",
    "close": "닫기",
    "newTabSuffix": "새 탭에서 열기",
    "noScript": "이 페이지의 링크를 보려면 JavaScript를 켜 주세요."
  }
}
